{
  "message_quality_score": 91,
  "commercial_clarity_score": 100,
  "context_match_score": 92,
  "one_objective_score": 90,
  "repetition_score": 95,
  "whatsapp_naturalness_score": 88,
  "risk_score": 14,
  "burn_risk": "low",
  "approved_to_send": true,
  "rewrite_suggestion": "",
  "corrected_message": "Encontrei voces no Google pesquisando por clinica odontologica na regiao. Meu contato e comercial: a ideia e mostrar oportunidades simples para melhorar site, WhatsApp e agendamentos. Quem cuida dessa parte por ai?",
  "judges": {},
  "digital_twin": {},
  "blocked_reasons": [],
  "analysis_mode": "profissional",
  "token_efficiency_mode": "profissional",
  "token_budget_level": "medium",
  "should_use_elite_mode": false,
  "elite_mode_reason": "",
  "estimated_token_cost_level": "medium",
  "data_loading_strategy": "recent_events_only",
  "large_context_allowed": false,
  "evaluated_at": "2026-05-29T12:01:00Z"
}
